ingles,traducao_pt
we're seeing lots of right rear locking,Estamos vendo muito travamento no traseiro direito
you might need more positive camber on the rears,Talvez você precise de mais cambagem positiva na traseira
"right rear is hot, your right rear is hot","O traseiro direito tá quente, tá bem quente mesmo"
your right rear tyre is hot,O pneu traseiro direito tá quente
"watch your right rear temperature, it's getting hot","Olha a temperatura do traseiro direito, tá esquentando"
we're seeing significant wear on both left side tyres,Estamos vendo desgaste significativo nos dois pneus do lado esquerdo
your left side tyres are looking pretty worn now,Os pneus do lado esquerdo estão bastante gastos agora
your left side tyres are both past their best,Os dois pneus do lado esquerdo já passaram do melhor ponto
softs,Pneus macios
you got significant tyre wear all around,Você tem desgaste significativo em todos os pneus
your tyres are all looking a bit worn,Todos os seus pneus parecem um pouco gastos
we're seeing some wear on each corner,Estamos vendo desgaste em cada canto do carro
you're locking your fronts into,Você tá travando os dianteiros na entrada
you're locking your fronts going into,Você tá travando os dianteiros entrando na
we're seeing front locking going into,Estamos vendo travamento na frente entrando na curva
"that right front's gone, mate","Esse dianteiro direito já foi, parceiro"
your right front looks pretty worn out,O dianteiro direito parece bem desgastado
that right front tyre looks knackered,Esse pneu dianteiro direito tá destruído
your right front inner is running,A temperatura interna do seu dianteiro direito está em
your right front inner is,A interna do seu dianteiro direito é
psi,psi
your front tyres are pretty knackered,Seus pneus dianteiros estão bem detonados
"your front tyres are worn out, mate","Seus pneus dianteiros estão gastos, parceiro"
your front tyres have gone,Seus pneus dianteiros já foram
left side tyres are cold,Pneus do lado esquerdo frios
your left side tyres are cold,Seus pneus do lado esquerdo estão frios
your front pressures are a bit low,Suas pressões dianteiras estão um pouco baixas
your right rear pressure is a bit low,A pressão do seu traseiro direito tá um pouco baixa
your rear tyres look pretty shot,Seus pneus traseiros parecem bem comprometidos
"your rear tyres are knackered, mate","Seus pneus traseiros tão detonados, parceiro"
your rear tyres are worn out,Seus pneus traseiros estão gastos
you've damaged your right rear tyre,Você danificou o pneu traseiro direito
that left front's looking heavily worn,Esse dianteiro esquerdo tá bem desgastado
"your left front tyre looks knackered, mate","Esse dianteiro esquerdo tá detonado, parceiro"
I think your left front's gone,Acho que o dianteiro esquerdo já foi
your right rear pressure looks a bit high,A pressão do seu traseiro direito parece um pouco alta
your left front pressure looks okay,A pressão do seu dianteiro esquerdo parece normal
"we can see some wear on those rear tyres, keep and eye out","Estamos vendo desgaste nesses pneus traseiros, fica de olho"
we're looking at significant wear on those rear tyres,Estamos vendo desgaste significativo nesses pneus traseiros
your rear tyres will be past their best soon,Seus pneus traseiros vão perder desempenho logo
your front tyres are cold,Seus pneus dianteiros estão frios
you got cold front tyres,Seus pneus dianteiros estão frios
your left rear pressure looks a bit low,A pressão do seu traseiro esquerdo parece um pouco baixa
hyper softs,Pneus hipermacios
your average front inner and outer temperatures are about the same,As temperaturas média interna e externa dos dianteiros estão parecidas
your average front inner and outer temps are about the same,As médias interna e externa dos dianteiros estão parecidas
more minutes for this set of tyres,Mais alguns minutos nesse jogo de pneus
more minutes on these tyres,Mais alguns minutos com esses pneus
right rear,Traseiro direito
rear right,Direito traseiro
your right side tyres have had it,Os pneus do lado direito já foram
"your right sides are knackered, mate","O lado direito tá destruído, parceiro"
your right side tyres are worn out,Os pneus do lado direito estão muito gastos
we're seeing rear wheel spin on the exit of,Estamos vendo giro nas rodas traseiras na saída de curva
you're spinning your rears on the exit of,Você tá girando as traseiras saindo da curva
you're spinning your rear tyres coming out of,Você tá girando os pneus traseiros saindo da curva
we're seeing lots of left rear locking,Estamos vendo muito travamento no traseiro esquerdo
you're locking your left rear,Você está travando o traseiro esquerdo
more laps out of this set of tyres,Mais voltas com esse jogo de pneus
more laps on this set of tyres,Dá pra mais voltas com esse jogo
more laps from this set of tyres,Dá pra tirar mais voltas desse jogo de pneus
your rear pressures look okay,Suas pressões traseiras parecem boas
you're spinning your left rear coming out of,Você tá girando o traseiro esquerdo saindo da curva
we're seeing left rear wheel spin in,Estamos vendo giro do traseiro esquerdo em
we're seeing left rear wheel spin on the exit of,Estamos vendo giro do traseiro esquerdo na saída da curva
right front,Dianteiro direito
front right,Direito dianteiro
"your front brakes are cooking, mate","Seus freios dianteiros tão fritando, parceiro"
your front brakes are far too hot,Seus freios dianteiros estão quentes demais
your front brakes are really hot,Seus freios dianteiros estão muito quentes
mediums,Pneus médios
celsius hotter than the outers,Graus Celsius mais quente que a parte externa
celsius hotter than your outers,Graus Celsius mais quente que os externos
your front tyres are flat spotted,Seus pneus dianteiros estão com ponto plano
super softs,Supermacios
we're seeing loads of wheel spin,Estamos vendo muito giro de rodas
you're getting a lot of front wheel spin,Você está tendo muito giro nas rodas dianteiras
you're spinning up your fronts,Você está girando os pneus dianteiros
your front pressures look a bit high,Suas pressões dianteiras parecem um pouco altas
your left front's hot,Seu dianteiro esquerdo está quente
your left front is hot,Seu dianteiro esquerdo está quente
your left front tyre is running hot,O pneu dianteiro esquerdo está aquecendo
you're spinning your right front coming out of,Você está girando o dianteiro direito saindo da curva
we're seeing right front wheel spin coming out of,Estamos vendo giro no dianteiro direito na saída da curva
you're spinning your right front in,Você está girando o dianteiro direito em
"there's some wear on those front tyres, mate","Tem desgaste nesses pneus dianteiros, parceiro"
you got some wear on your front tyres,Você está com algum desgaste nos pneus dianteiros
we're seeing significant wear on the fronts,Estamos vendo desgaste significativo nos dianteiros
your left front pressure looks very high,A pressão do seu dianteiro esquerdo parece muito alta
A's,A’s
B's,B’s
your left rear inner and outer temperatures are about the same,As temperaturas interna e externa do traseiro esquerdo estão parecidas
your left rear inner and outer temps are about the same,Interna e externa do traseiro esquerdo estão parecidas
your inner and outer temps are about the same for your left rear,As temperaturas interna e externa do traseiro esquerdo são semelhantes
your right front pressure is very low,A pressão do seu dianteiro direito está muito baixa
your rear brakes are starting to overheat,Seus freios traseiros estão começando a superaquecer
your rear brakes are getting pretty hot,Seus freios traseiros estão ficando bem quentes
your rear brakes are hot,Seus freios traseiros estão quentes
your average rear inner and outer temperatures are about the same,A média das temperaturas interna e externa dos traseiros está parecida
your average rear inner and outer temps are about the same,As médias interna e externa dos traseiros estão semelhantes
plenty of battery,Bateria cheia
the battery's has got plenty of charge in it,A bateria está com bastante carga
you got loads of energy,Você tem muita energia
you got plenty of battery energy,Você tem bastante energia da bateria
percent,Porcentagem
we're low on charge,Estamos com pouca carga
"the battery level is looking pretty low, now",O nível da bateria está ficando bem baixo agora
the battery level is low,O nível da bateria está baixo
minutes,Minutos
"that's half distance, the battery looks good, we think we'll make it to the end","Metade da corrida, a bateria parece boa, achamos que vamos até o fim"
"half distance, the battery power looks okay","Meio da prova, a bateria tá ok"
"half distance, the battery looks good, we'll make it to the end","Meio da corrida, a bateria parece boa, vamos até o final"
"half distance, we should have enough power to get to the end","Metade da corrida, devemos ter energia suficiente até o fim"
we think we'll be out of battery in 3 laps,Achamos que vamos ficar sem bateria em 3 voltas
we got enough power for 3 more laps,Temos energia para mais 3 voltas
we got about 3 laps left in the battery,Temos cerca de 3 voltas restantes de bateria
"this battery is had it, it's about to run out","Essa bateria já era, vai acabar"
this battery is pretty much done,Essa bateria praticamente acabou
"this battery is about to run out, mate","Essa bateria tá prestes a acabar, parceiro"
we'll get about,Vamos conseguir cerca de
we're good for another,Dá pra mais uma
"we'll need to stop before the end of the race, we don't have enough energy","Vamos precisar parar antes do fim, não temos energia suficiente"
"we don't have enough battery to make it to the end of the race, we'll need to stop","Não temos bateria suficiente pra terminar a corrida, vamos precisar parar"
"we don't have enough energy to get to the end, we'll need to stop","Não temos energia suficiente pra chegar ao fim, precisaremos parar"
your energy use is reducing,Seu consumo de energia está diminuindo
your battery use is reducing,Seu consumo de bateria está diminuindo
your battery use is dropping,Seu uso de bateria está caindo
should be able to make the midpoint of the race on the current charge,Deve dar pra chegar até a metade da prova com a carga atual
should be able to reach the middle of the race on the current charge,Deve dar pra alcançar o meio da corrida com essa carga
the current charge should last you to the midpoint of the race,A carga atual deve durar até a metade da prova
laps remaining in the battery,Voltas restantes na bateria
laps of energy remaining,Voltas de energia restantes
laps of charge remaining,Voltas de carga restantes
the battery is now at half power,A bateria está agora em metade da carga
"we got half the battery power left, now",Estamos com metade da carga da bateria agora
we got half our battery charge remaining,Temos metade da carga da bateria restante
there's about 4 laps left in the battery,Cerca de 4 voltas restantes de bateria
the battery will last about 4 more laps,A bateria vai durar cerca de mais 4 voltas
we got 4 laps of battery power left,Temos 4 voltas restantes de energia
we've got about 5 more minutes on this battery,Temos cerca de 5 minutos restantes nessa bateria
there's about 5 minutes left in this battery,Cerca de 5 minutos restantes nessa bateria
this battery will last about 5 more minutes,Essa bateria vai durar cerca de mais 5 minutos
we think you'll make it to the end on your current charge,Achamos que você vai conseguir terminar com a carga atual
your current charge level should last to the end of the race,Sua carga atual deve durar até o fim da corrida
you should be able to make it to the end on this charge,Deve dar pra chegar até o final com essa carga
"we don't have enough energy to get us to half distance, we'll need to stop","Não temos energia suficiente pra chegar até metade da prova, vamos precisar parar"
we're not going to make it to half distance without a pit stop,Não vamos conseguir chegar à metade da corrida sem parar
"you don't have enough energy to make it to half way, we'll need to stop","Você não tem energia suficiente pra chegar à metade, vamos ter que parar"
percent battery remaining,Porcentagem de bateria restante
percent of charge remaining,Porcentagem de carga restante
percent remaining,Porcentagem restante
we think about,Achamos que
we estimate,Estimamos que
it looks like,Parece que
your battery use is stable,Seu uso de bateria está estável
your battery use is now stable,Seu consumo de bateria agora está estável
your battery use is stabilized,O uso de bateria estabilizou
"that's half distance, at this rate we won't make it to the end on this charge","Metade da corrida, nessa taxa não vamos até o fim com essa carga"
"that's half distance, we don't have enough energy to get to the end","Metade da corrida, não temos energia suficiente até o fim"
"that's half distance, we haven't got enough energy to get to the end","Metade da corrida, não temos energia suficiente pra chegar ao fim"
"that's half distance, we'll be out of battery before the end","Metade da corrida, ficaremos sem bateria antes do final"
Laps ,Voltas
on last lap you used,"Na última volta, você usou"
on your last lap you used,"Na sua última volta, você usou"
on the last lap you used,"Na volta passada, você usou"
your battery is almost empty,Sua bateria está quase vazia
the battery level is really low,O nível da bateria está muito baixo
the battery is really low,A bateria está bem baixa
"critical battery level, we're really low on energy","Nível crítico de bateria, estamos com energia muito baixa"
one lap of battery power left,Uma volta restante de bateria
there's one lap left in this battery,Falta uma volta nessa bateria
one lap left on our current charge,Uma volta restante com a carga atual
you won't make it to the end unless you reduce your battery use,"Se não economizar bateria, não vai chegar até o final"
you'll need to drop your battery use to make it to the end of the race,Vai ter que aliviar no consumo se quiser completar a corrida
you'll need to reduce your battery use if you're going to make it to the end,Precisa baixar o uso da bateria se quiser ver a bandeirada
minutes of charge remaining,Minutos de carga restantes
minutes left in the battery,Minutos sobrando na bateria
minutes of energy remaining,Minutos de energia restante
percent per lap,Porcentagem por volta
you'll need to drop your battery use if you're going to make mid point of the race,Vai ter que reduzir o uso da bateria se quiser chegar na metade da prova
you'll need to reduce your battery use to reach the halfway point,Precisa diminuir a bateria pra alcançar o meio da corrida
you'll need to reduce your battery use to reach half distance,Vai ter que economizar bateria pra bater a metade da distância
percent of your battery,Porcentagem da bateria
percent of your remaining battery,Porcentagem do que sobrou de bateria
percent of your energy,Porcentagem da sua energia
"you can increase your battery usage now, we've got plenty of energy to get us to the end","Pode gastar mais bateria agora, temos energia de sobra até o fim"
"we've got plenty of battery to make the end, you can increase your energy usage","Temos bateria pra completar, pode mandar mais energia"
"increase your energy usage, we've got plenty of energy to spare, we'll make it to the end","Aumenta o uso aí, sobra de energia total, vamos até o final tranquilo"
your energy use is increasing,Teu consumo de energia tá subindo
your battery use is increasing,O uso de bateria tá aumentando
"you can increase your energy usage, we have more than we need to make it to the midpoint","Pode subir o uso de energia, temos bem mais que o necessário pra chegar na metade"
"increase your battery usage, we've got more than enough energy to make half distance","Aumenta o uso da bateria, tem energia de sobra pra metade da prova"
"we have more than enough energy to make half distance, you can increase your battery usage","Temos energia mais que suficiente pra metade da corrida, pode mandar ver na bateria"
we got enough charge for 2 more minutes,Temos carga suficiente pra mais dois minutos
we've got 2 minutes left in this battery,Restam dois minutos nessa bateria
we'll be out of battery in 2 minutes,A bateria acaba em dois minutos
2 laps remaining in the battery,Duas voltas restantes com essa bateria
we got enough power for 2 laps now,Temos força pra mais duas voltas agora
we think about 2 laps left in this battery,Achamos que restam cerca de duas voltas nessa bateria
we'll be out of battery in about 10 minutes,A bateria deve acabar em cerca de dez minutos
there's about 10 minutes left in this battery,Faltam mais ou menos dez minutos nessa bateria
we got about 10 minutes of charge left,Temos por volta de dez minutos de carga restante
incidents,Incidentes
the incident points limit is,O limite de pontos de incidente é
there's no incident points limit,Não tem limite de pontos de incidente
the incident limit is,O limite de incidentes é
you have,Você tem
there's no incident limit,Sem limite de incidente
incident points,Pontos de incidente
behind,Atrás
we need to set a benchmark lap time first,Precisamos cravar uma volta de referência primeiro
we need to set a decent lap first,Primeiro tem que sair uma volta decente
we need to set some laptimes first,Vamos marcar uns tempos de volta primeiro
we are sharing our pit box with,Estamos dividindo box com
and,e
we think he'll come out just in front,Achamos que ele vai sair bem na tua frente
he should come out close in front of you,Deve sair colado na tua frente
we think he'll come out close in front,"A gente acha que ele sai próximo, à frente"
he should come out just in front of you,Deve sair logo ali na tua frente
looks like he'll come out just in front of you,Parece que ele vai sair justinho à tua frente
we think he'll come out just in front of you,A gente acha que ele vai aparecer ali na tua frente
we think he'll be close in front of you when he exits,Deve sair perto de você quando deixar os boxes
a few seconds in front of,Alguns segundos à frente de
a few seconds ahead of,Alguns segundos adiante de
we expect there'll be no traffic on exit,A gente espera pista limpa na saída
we don't expect any traffic on the pit exit,Não esperamos tráfego na saída do pit
we expect you'll be coming out of the pits into clear air,Provável que você saia dos boxes no ar limpo
expect a clear track on exit,Espera pista livre na saída
we think you'll be exiting the pits into clear air,Achamos que você sai dos boxes com pista livre
you should have plenty of space on the exit,Deve ter espaço de sobra quando sair
you should be coming out into clear air,Deve sair direto no limpo
"is entering the pits, he's in P","Tá entrando nos boxes, tá em Pê"
is pitting from position,Parando a partir da posição
is pitting from P,Parando da Pê…
"this is our benchmark pit stop, we need race pace on the in-lap and the out-lap","Essa é nossa parada de referência, ritmo de corrida na volta de entrada e saída"
"okay, we'll time this stop","Beleza, vamos cronometrar essa parada"
"this'll be our benchmark pit stop, race pace on the in-lap and the out-lap","Essa vai ser nossa parada de benchmark, ritmo forte na entrada e saída"
"we need race pace on the in-lap and the out-lap, this'll be our benchmark","Precisa ritmo de prova na entrada e saída, essa é a referência"
"understood, we'll time this stop, use it as a benchmark","Fechado, vamos marcar o tempo, usa como base"
"okay, we'll use this stop as a benchmark","Feito, essa parada vai ser a referência"
"okay, race pace on the outlap until sector 2, this'll be our benchmark stop","Certo, ritmo de prova até o setor dois, essa aqui é nossa parada de benchmark"
"this is our benchmark stop, we'll be timing the in-lap and the out-lap, race pace","Essa é nossa parada de referência, vamos cronometrar entrada e saída com ritmo"
"okay, this is our benchmark stop, race pace until sector 2","Ok, parada de benchmark, ritmo de prova até o setor dois"
"acknowledged, we'll time this stop, race pace on the in-lap and out-lap until sector 2, please","Entendido, vamos marcar o tempo, ritmo forte na entrada e saída até o setor dois, por favor"
right behind,Tá logo atrás
immediately behind,Bem colado atrás
just behind,Pouco atrás
a few seconds behind,Alguns segundos atrás
in front of,Na frente
ahead of,Adiante
when we exit the pits we'll be in P,"Quando a gente sair dos boxes, vamos estar em Pê"
we expect to exit the pits in position,A gente espera sair dos boxes já na posição
when we exit the pits we should be in position,"Ao sair do pit, devemos estar na posição"
on exit we should be in position,"Na saída, devemos cair na posição certa"
when we exit the pits we should be in P,"Ao sair do pit, devemos cair em Pê"
when we leave the pits we think we'll be in P,"Quando deixarmos o pit, achamos que voltamos em Pê"
we should come out into position,A gente deve sair direto na posição
we'll calculate your time loss from your next flying lap,Vamos calcular a perda de tempo com base na próxima volta lançada
we'll work out the time loss based on your next flying lap,Vamos descobrir quanto perdemos baseando na próxima volta rápida
we'll calculate the time loss based on your next flying lap,A gente calcula a perda com base na tua próxima volta rápida
just ahead of,Um pouquinho à frente de
just in front of,Logo na frente de
right ahead of,Bem na frente de
right in front of,"Bem na frente, colado"
there'll be traffic on the exit,Vai ter tráfego na saída
there'll be traffic when you exit the pits,Vai ter trânsito quando você sair dos boxes
expect traffic when you come out,Espera tráfego quando sair
you'll be coming out into traffic,Você vai sair no meio do trânsito
expect traffic when you exit the pits,Deve pegar tráfego na saída dos boxes
expect traffic on exit,Vai sair em tráfego
it looks like pitting will lose us about,Parece que a parada vai nos custar cerca de
we think a pit stop costs us,A gente acha que a parada vai custar mais ou menos
we think a pit stop costs about,Achamos que uma parada vai custar mais ou menos isso aí
a pit stop will cost us,Essa parada vai custar pra gente
a pit stop will lose us about,A parada vai nos fazer perder mais ou menos isso
looks like a pit stop costs us about,Parece que a parada custa mais ou menos isso
in between,No meio
between,Entre
right with,Junto com
really close between,Bem próximo entre eles
really close to,Colado ali
close between,Disputa apertada entre eles
he should be a little bit behind when he comes out,Ele deve sair um pouco atrás quando voltar
we think he'll come out a little way behind you,Achamos que ele sai um pouco mais atrás de você
he should come out a little way behind you,Ele deve aparecer um pouco mais atrás
we think he'll come out just behind you,Achamos que ele vai sair logo atrás
it looks like he'll come out just behind you,Parece que ele sai logo atrás de você
expect him to come out a bit behind you,Espera ele sair um pouco mais pra trás
radio check,Checando rádio
into 4 right,Entrando em quatro direita
early,Antecipado
80,Oitenta
3 right,Três direita
into care,Entrando com cuidado
right 3,Direita três
tightens to 6,Fecha pra seis
1,Um
keep in,Mantém por dentro
into medium right,Entrando em média pra direita
penalty false start,Penalidade por largada antecipada
slippery,Escorregadio
gravel,Cascalho
immediate,Imediato
tarmac,Asfalto
onto tarmac,Entrando no asfalto
continues over crest,Segue sobre o topo
hairpin left,Gancho esquerda
40,Quarenta
over crest,Sobre o topo
tightens to hairpin,Fecha pra gancho
outside,Por fora
finish,Final
1 left,Um esquerda
junk-shun,Cruzamento
dip,Depressão
care,Atenção
flat left,Esquerda plena
3 left,Três esquerda
50,Cinquenta
square left,Esquerda em ângulo reto
right entry chicayne,Chiqueine com entrada pela direita
open hairpin left,Gancho aberto pra esquerda
brake,Freia
into 3 right,Entrando em três direita
don't cut early,Não corta antecipado
open hairpin right,Gancho aberto pra direita
over bridge,Sobre a ponte
right flat,Direita plena
4 left,Quatro esquerda
left entry chicayne,Chiqueine com entrada pela esquerda
small crest,Topinho
into flat right,Entrando em direita plena
tightens to 1,Fecha pra um
into 1 right,Entrando em um direita
caution water,Atenção: água
twisty,Trecho sinuoso
round,Curva fechada
tree inside,Árvore por dentro
into 5 right,Entrando em cinco direita
deep ruts,Valetas fundas
800,Oitocentos
danger,Perigo
we are lost,A gente se perdeu
right 6,Direita seis
hole,Buraco
into 3 left,Entrando em três esquerda
ruts,Valetas
full cut,Pode cortar tudo
tightens bad,Fecha feio
keep left,Mantém à esquerda
crest,Topo
into hairpin right,Entrando em gancho à direita
deceptive,Enganoso
right 4,Direita quatro
square right,Direita em ângulo reto
6 right,Seis direita
downhill,Descendo
uphill,Subindo
into ford,Entrando na travessia d'água
rocks inside,Pedras por dentro
into fast right,Entrando em direita rápida
sharp,Afiado
slippy,Escorregadio
rocks outside,Pedras por fora
easy,Suave
slight right,Leve pra direita
to 2,Até dois
hold,Segura
fast left,Esquerda rápida
half long,Meia distância
left 6,Esquerda seis
left square,Esquerda quadrada
care in,Atenção entrando
into slight left,Entrando leve pra esquerda
"OK, we're starting our stage reh-key","Beleza, começando nosso reconhecimento de terreno"
fast right,Direita rápida
into 2 left,Entrando em dois esquerda
late apex,Apex tardio
keep middle,Mantém no meio
into 4 left,Entrando em quatro esquerda
5 left,Cinco esquerda
caution,Cuidado
5 right,Cinco direita
left 4,Esquerda quatro
tree outside,Árvore por fora
into square left,Entrando em esquerda quadrada
long long,"Longa, bem longa"
don't cut,Não corta
jump,Salto
care out,Atenção saindo
