ingles,traducao_pt
"keep it between the white lines, they'll delete the lap and they'll delete the next one, too","Fica entre as linhas brancas, essa volta vai ser anulada, e a próxima também"
"track limits, they'll delete the next lap as well as this one","Limite de pista, essa e a próxima volta vão ser anuladas"
"come on, concentrate, keep it between the white lines, you've lost this lap and the next one","Pô, concentra! Fica dentro da pista, você perdeu essa volta e também a próxima"
"track limits, they'll delete this lap and the next one","Limite de pista, essa volta e a próxima tão fora"
"track limits, come on, they're gonna delete this lap and they'll delete the next one, too","Limite de pista, pô mano, essa volta vai ser anulada, e a próxima também"
"you've cut the track, they're gonna delete the lap and they'll delete the next one, too","Cê cortou a pista, essa volta já era, e a próxima também vai pro saco"
"you've gone out of track limits, they'll delete this lap and the one after it","Você passou do limite, essa volta e a seguinte vão ser anuladas"
"track limits, come on, concentrate, they're gonna delete the next lap, too","Limite de pista, pô, concentra aí, a próxima volta também vai ser anulada"
"watch those track limits, they'll delete this lap","Fica esperto com esses limites, essa volta já era"
"track limits, this lap will be deleted","Limite de pista, essa volta será anulada"
you've gone outside of track limits there,Você passou dos limites da pista ali
"come on, keep it between the lines, they'll delete this lap","Vamos lá, mantém dentro das linhas, essa volta vai ser anulada"
"this lap won't count, track limits","Essa volta não conta, limite de pista"
"this lap will be invalidated, watch the track limits","Essa volta foi invalidada, cuidado com os limites da pista"
"track limits, come on, keep it between the white lines","Limite de pista, foco, fica entre as linhas brancas"
"this lap won't count, you've cut the track","Essa volta não valeu, você cortou a pista"
watch those track limits,Atenção aos limites da pista
"track limits, the lap won't count","Limite de pista, essa volta não vale"
"come on, man, watch them track limits, this lap won't count","Pô mano, fica atento aos limites, essa volta não valeu"
"track limits, come on, this lap will be deleted","Limite de pista, se liga, essa volta vai ser anulada"
"this lap won't count, watch those track limits","Essa volta não conta, atenção aos limites da pista"
"this lap will be deleted, watch the track limits","Essa volta será anulada, presta atenção nos limites"
"the stewards have warned us for cutting the track, they'll delete this lap","Os comissários alertaram sobre corte de pista, essa volta vai ser anulada"
"they'll delete this lap, you've cut the track","Eles vão anular essa volta, você cortou a pista"
"come on, keep it between the white lines, this lap won't count","Concentra, mantém entre as linhas brancas, essa volta não vai contar"
"track limits, come on, this lap won't count","Limite de pista, foco, essa volta não valeu"
keep it between the white lines,Fica entre as linhas brancas
"come on, watch those track limits, this lap will be deleted","Se liga nos limites, essa volta vai ser anulada"
"track limits, they'll invalidate this lap","Limite de pista, essa volta foi invalidada"
be careful,Toma cuidado
take care please,"Toma cuidado, por favor"
be careful please,"Tenha cuidado, por favor"
"come on, wake up","Acorda aí, pô!"
"come on, be careful","Pô mano, cuidado aí"
"watch the track limits, we'll get a penalty if we don't","Fica atento aos limites da pista, senão vamos levar punição"
we've been warned about track limits,A gente já foi avisado sobre os limites da pista
the stewards have warned us about track limits,Os comissários já deram um alerta sobre os limites da pista
"the stewards have warned us for cutting the track, keep it between the white lines","Os comissários nos advertiram por cortar a pista, mantém entre as linhas brancas"
"you've gone outside track limits, come on, keep it between the lines","Você passou do limite da pista, pô, fica entre as linhas"
"come on, track limits","Pô, limite de pista aí"
"come on, track limits, keep it between the lines","Se liga, limite de pista, mantém dentro das linhas"
watch the track limits,Atenção aos limites da pista
"the stewards have warned us about track limits, keep it between the lines","Os comissários alertaram sobre os limites, fica entre as linhas"
"keep it between the lines, track limits",Mantém o carro nos limites da pista
keep it between the white lines or we'll get a penalty,"Mantém entre as linhas brancas, senão vem punição"
"watch those track limits, we don't want a penalty","Fica de olho nesses limites, a gente não quer penalidade"
we just had a warning for cutting the track,Recebemos um aviso por corte de pista
"track limits, come on","Limite de pista, pô!"
watch those track limits or we'll get a penalty,"Olho vivo nos limites, senão vamos levar punição"
keep it within the track limits,Mantém dentro dos limites da pista
"we'll need to pit for repairs, we've been called in by the stewards","Precisamos parar pra reparos, os comissários chamaram a gente pros boxes"
we've been called into the pits for repairs,Chamaram a gente pros boxes pra fazer reparos
"meatball flag, we'll need to come into the pits for repairs","Bandeira meatball, vamos ter que entrar pros boxes e consertar"
we've been called into the pits by the stewards for repairs,Os comissários pediram nossa entrada nos boxes pra reparos
the stewards have called us into the pits for repairs,"Fomos chamados pelos comissários pros boxes, é hora de reparar"
we've just had a drive-through penalty for speeding in the pit lane,Levamos uma penalidade de drive-through por excesso de velocidade no pit lane
we just had a drive-through for speeding in the pit lane,Acabamos de levar um drive-through por acelerar demais no pit lane
we've just been given a drive-through for speeding in the pit lane,Recebemos um drive-through por excesso de velocidade nos boxes
we've just had a drive-through for cutting the track,Drive-through aplicado por corte de pista
we've just had a drive-through penalty for cutting the track,Acabamos de levar uma penalidade de drive-through por corte de pista
we've had a drive-through penalty for track limits violations,Levamos uma penalidade de drive-through por violar os limites da pista
we've had a drive-through for track limits violations,Tomamos um drive-through por violar os limites da pista
we've had a drive-through penalty for cutting the track,Penalidade de drive-through por corte de pista
we've had a drive-through for cutting the track,Drive-through por cortar a pista
you don't have a penalty,Sem penalidade no momento
start respecting the track limits,Começa a respeitar os limites da pista
"track limits, for fuck's sake, come on, track limits","Limite de pista, pô mano, presta atenção nisso!"
pay some attention to the track limits,Dá atenção nesses limites aí
can you even see the track? stop cutting,Tá conseguindo ver a pista ou tá de zoeira? Para de cortar!
"shit, I'm sick of saying this, track limits","Cara, tô cansado de repetir, respeita o limite de pista"
"come on, track limits, they're there for a reason, stop taking the piss","Pô, limite de pista tá aí por um motivo, colabora!"
are you even trying to keep it on the track,Tá tentando manter na pista ou só tá passeando?
"track limits again, come on","De novo limite de pista, aí não dá!"
"that's another cut, come on, pay attention","Mais um corte, se liga, presta atenção"
track fucking limits,"Limite de pista de novo, pelo amor!"
we've just been disqualified for ignoring the drive-through,Fomos desclassificados por ignorar o drive-through
we've just been disqualified for ignoring a drive-through penalty,Desclassificação por não cumprir a penalidade de drive-through
"you've ignored your drive-through penalty, they've just disqualified you","Você ignorou o drive-through, acabaram de te desclassificar"
"they've just disqualified us, we've ignored a drive-through penalty","Desclassificação confirmada, a gente não cumpriu o drive-through"
"okay, mate, we've been disqualified for ignoring a drive-through","Ok, parceiro, fomos desclassificados por ignorar o drive-through"
we've had a stop-go penalty for a false start,Levamos uma penalidade de stop-go por queima de largada
we've just had a stop-go penalty for jumping the start,Acabamos de tomar um stop-go por largada antecipada
we've got a stop-go penalty for jumping the start,Temos uma penalidade de stop-go por pular a largada
you still haven't served this penalty,Você ainda não cumpriu essa penalidade
you still need to serve your penalty,Você ainda precisa servir sua penalidade
you've still got an outstanding penalty,Você ainda tá com uma penalidade pendente
you got 3 laps to serve this penalty,Você tem três voltas pra cumprir essa penalidade
you've got 3 laps to serve this penalty,Ainda restam três voltas pra cumprir a penalidade
you need to come in for this penalty in the next 3 laps,Tem que entrar nos boxes pra cumprir isso nas próximas três voltas
we've just had a slowdown penalty for cutting the track,Acabamos de levar uma penalidade de desaceleração por corte de pista
we've had a slowdown penalty for cutting the track,Recebemos uma penalidade de desaceleração por cortar a pista
we've just had a drive-through for overtaking under yellow,Acabamos de tomar um drive-through por ultrapassar sob bandeira amarela
we've just had a drive-through penalty for passing under yellow,Drive-through aplicado por passar sob bandeira amarela
we've just had a drive-through for passing under yellow,Levamos um drive-through por desrespeitar bandeira amarela
we've just had a stop-go penalty for speeding in the pit lane,Acabamos de receber uma penalidade de stop-go por excesso de velocidade no pit lane
we've got had a stop-go penalty for speeding in the pit lane,Temos uma penalidade de stop-go por velocidade acima do limite nos boxes
we've just had a stop-go penalty for overtaking on the formation lap,Tomamos uma penalidade de stop-go por ultrapassar na volta de formação
we've just had a stop-go penalty for passing on the formation lap,Penalidade de stop-go por ultrapassagem durante a volta de formação
mind these track limits,Fica atento aos limites da pista
"this lap won't count, you cut the track","Essa volta não valeu, você cortou a pista"
we need to watch these track limits,Precisamos ficar de olho nesses limites da pista
"they'll invalidate this lap, track limits","Essa volta vai ser invalidada, cuidado com os limites"
"track limits, keep it between the lines","Limite de pista, mantém dentro das linhas"
track limits,Limites de pista
"they'll delete this lap, track limits","Essa volta vai ser anulada, limite de pista"
you're outside of track limits there,Você passou dos limites da pista ali
we need to watch the track limits,Precisamos prestar atenção nos limites da pista
we still need to serve this stop-go penalty,Ainda temos que cumprir essa penalidade de stop-go
we've still got to serve our stop-go penalty,Ainda temos uma penalidade de stop-go pra cumprir
you've still got to serve your stop-go penalty,Você ainda precisa cumprir sua penalidade de stop-go
you still have to serve your stop-go penalty,Você ainda tem que cumprir essa penalidade de stop-go
"stop driving into people, they'll disqualify us if we do it again","Para de bater nos outros, mais uma dessas e a gente vai ser desclassificado"
"we'll be disqualified if we hit another car, calm down","Se batermos de novo, tamo fora, segura a onda aí"
"one more collision and we're out, stop with the banger racing","Mais uma batida e tamo fora, para com essa de demolição"
"come on, this ain't banger racing, one more collision and we'll be disqualified","Pô, isso aqui não é racha de demolição, mais uma colisão e tamo desclassificado"
"calm it down please, one more collision and we'll be out","Dá uma segurada, mais uma batida e a corrida acaba pra gente"
"you're one collision away from being disqualified, calm down","Cuidado, tá a uma colisão de ser desclassificado"
"come on, watch these track limits","Pô, presta atenção nesses limites de pista"
"watch the track limits, please","Fica atento aos limites da pista, por favor"
you gotta watch these track limits,Fica atento aos limites da pista
we just had a drive-through for overtaking on the formation lap,Levamos um drive-through por ultrapassar na volta de formação
we've just had a drive-through penalty for passing on the formation lap,Acabamos de receber uma penalidade de drive-through por ultrapassagem na volta de formação
we just had a drive-through for passing on the formation lap,Acabamos de levar um drive-through por ultrapassar durante a volta de formação
watch these track limits,Atenção a esses limites da pista
stay within the track limits,Fique dentro dos limites da pista
"you've gone out of track limits again, they'll delete this lap","Você passou dos limites de novo, essa volta vai ser anulada"
"they'll delete this lap, stay within the track limits","Eles vão excluir essa volta, mantém dentro dos limites da pista"
"that's another cut, track limits","Mais um corte, limite de pista"
"come on, track limits, that's another cut","Pô mano, limite de pista de novo, mais um corte aí!"
"track limits, they'll delete this lap","Limite de pista, essa volta vai ser anulada"
"that's another cut, this lap will be deleted","Mais um corte, essa volta tá anulada"
we've just been given a time penalty,Acabamos de levar uma penalidade de tempo
we've just been handed a time penalty,Penalidade de tempo recebida agora há pouco
"bollocks, we've just had a time penalty","Droga, levamos uma penalidade de tempo agora"
we've just had a time penalty,Acabamos de ser penalizados com tempo extra
penalty points will be awarded this lap,Pontos de penalidade vão ser aplicados nessa volta
"you've exceeded your allotted laps, you've been disqualified","Você passou do limite de voltas, foi desclassificado"
"we've done more laps than we're allowed here, we've been disqualified","Excedemos o número de voltas permitido aqui, estamos desclassificados"
"we've exceeded our allotted laps, we've been disqualified","Passamos do número de voltas, fomos desclassificados"
we've been disqualified for exceeding the maximum number of laps allowed,Fomos desclassificados por exceder o número máximo de voltas permitido
you've been disqualified for exceeding the number of qualification laps allowed,Você foi desclassificado por ultrapassar o limite de voltas de qualificação
"you keep cutting, come on, track limits","Você continua cortando pista, pô, presta atenção nisso!"
we've got to pay attention to the track limits,Temos que ficar ligados nos limites de pista
"this lap will be deleted, watch those track limits","Essa volta vai ser anulada, atenção aos limites"
"that's another deleted lap, track limits","Mais uma volta excluída, limite de pista"
"come on, track limits, you're starting to take the piss now","Limite de pista, pô, já tá abusando"
just watch these fucking track limits,"Dá atenção pra esses limites, tá demais!"
"ah shit, man, that's another lap deleted, track limits","Ah não, cara… mais uma volta anulada por limite de pista"
"come on, watch these fucking track limits","Vamos lá, atenção nesses limites, não dá pra continuar assim"
we got 2 laps to come in for this penalty,Temos duas voltas pra entrar e cumprir essa penalidade
we got 2 laps left to come in and serve this penalty,Restam duas voltas pra gente entrar e servir a penalidade
we need to come in for this penalty in the next 2 laps,Precisamos entrar nos boxes pra cumprir a penalidade nas próximas duas voltas
come in to serve this penalty in the next 2 laps,Entra nos boxes e cumpre essa penalidade nas próximas duas voltas
we've got 1 lap to serve this drive-through penalty,Temos uma volta pra cumprir essa penalidade de drive-through
we've got 1 lap left to serve this drive-through penalty,Só resta uma volta pra cumprir o drive-through
we got 1 lap to serve this drive-through penalty,Uma volta restante pra cumprir a penalidade de drive-through
1 lap to serve the drive-through penalty,Uma volta pra servir a penalidade de drive-through
we've just had a stop-go penalty for passing under yellow,Acabamos de levar uma stop-go por ultrapassagem sob bandeira amarela
we've just had a stop-go penalty for passing under yellow flag,"Penalidade de stop-go por passar sob bandeira amarela, foi agora"
we've just had a stop-go penalty for overtaking under yellow,Acabamos de ter uma penalidade de parada por ultrapassar em amarelo
we've just had a stop-go penalty for cutting the track,Levamos uma penalidade de stop-go por cortar a pista
we need to come and serve our penalty on this lap,Precisamos entrar agora pra cumprir essa penalidade
we've been disqualified,Fomos desclassificados
"the bastards have just disqualified us, missed that stupid penalty",Ah não fomos desclassificados por não cumprir aquela penalidade absurda
looks like we've been disqualified,"Pelo visto, fomos desclassificados"
we've been disqualified for driving in the dark without headlights,"Fomos desclassificados por dirigir no escuro, sem os faróis ligados"
we've just been disqualified for driving in the dark without headlights,Acabamos de ser desclassificados por pilotar sem faróis no escuro
"we've been driving in the dark without headlights, we've been disqualified",Estávamos rodando no escuro sem faróis e fomos desclassificados
"just been disqualified, you've been driving without headlights","Você foi desclassificado, tava dirigindo sem os faróis ligados"
we've had a drive-through for a false-start,Levamos um drive-through por queima de largada
drive-through penalty for a false-start,Penalidade de drive-through por largada falsa
we've been given a drive-through penalty for a false-start,Recebemos uma penalidade de drive-through por queima de largada
we've had a drive-through penalty for a false-start,Tivemos uma penalidade de drive-through por largada falsa
we've got a drive-through for a false start,Temos um drive-through por queima de largada
we've just had a drive-through for a false-start,Acabamos de levar um drive-through por largada antecipada
we've just had a drive-through for jumping the start,Acabamos de levar um drive-through por pular a largada
you have a penalty,Você recebeu uma penalidade
we've had a drive-through penalty for exceeding the maximum driver stint time,Tivemos uma penalidade de drive-through por ultrapassar o tempo máximo de stint
"you've exceeding the driver stint time, you got a drive-through penalty","Você ultrapassou o tempo permitido de stint, levou um drive-through"
"we've exceeding the maximum driver stint time, you've got a drive-through penalty","Ultrapassamos o tempo máximo de stint, recebemos um drive-through"
"we've had a drive-through penalty, you've exceeded the maximum driver stint time","Levamos um drive-through, você passou do tempo máximo de stint"
you're driving too slowly,Você tá dirigindo devagar demais
"we're going too slowly, speed up","Tamo muito lento, acelera aí"
"you're going too slowly, speed up","Tá devagar demais, pisa um pouco mais"
we've had a warning for driving too slowly,Recebemos um aviso por estar devagar demais
"ah, we're disqualified, mate, we ignored a stop-and-go penalty","Ah não, fomos desclassificados, ignoramos a penalidade de stop-go"
we've been disqualified for ignoring a stop-and-go penalty,Fomos desclassificados por não cumprir a penalidade de stop-go
"you've just been disqualified, you've ignored your stop-and-go penalty","Você foi desclassificado, ignorou a penalidade de stop-go"
"they've just disqualified us, we've ignored a stop-and-go penalty","Acabaram de nos desclassificar, a penalidade de stop-go foi ignorada"
we need to come in for this drive-through at the end of the lap,Precisamos entrar no final desta volta pra cumprir o drive-through
we need to serve this drive-through penalty at the end of this lap,Temos que cumprir essa penalidade de drive-through no final desta volta
we need to serve this drive-through penalty on this lap,Precisamos cumprir o drive-through nesta volta
come in at the end of this lap for your drive-through penalty,Entra no final dessa volta pra servir o drive-through
we've just been handed a stop-go penalty,Acabamos de receber uma penalidade de stop-go
we've just had a stop-go penalty,Recebemos agora há pouco uma penalidade de stop-go
"bollocks, we've had a stop-go","Droga, tomamos uma stop-go"
we've just been given a stop-go penalty,Acabamos de ser penalizados com uma stop-go
"aw, crap, we've just had a stop-go penalty",Poxa acabamos de tomar uma stop-go
"you've exceeded the maximum driver stint time, we got a stop-go penalty","Você passou do tempo máximo de stint, levamos uma penalidade de stop-go"
"we've had a stop-go penalty, we've exceeded the driver stint time maximum",Tomamos uma penalidade de stop-go por ultrapassar o tempo máximo de stint
"you've exceeded the driver stint time, you got a stop-go penalty","Você passou do tempo de stint, levou uma penalidade de stop-go"
we've just had a stop-go penalty for exceeding the maximum driver stint time,Acabamos de levar uma penalidade de stop-go por passar do tempo máximo de stint
"we've used our lap allowance, we need to pit this lap","Já usamos o número máximo de voltas, precisamos entrar nos boxes nesta volta"
enter the pits to avoid exceeding your lap allowance,Entra nos boxes agora pra não ultrapassar o limite de voltas
box this lap to avoid exceeding your lap allowance,Box nessa volta pra evitar ultrapassar o número de voltas permitidas
enter the pits to avoid exceeding the lap allowance,Entra nos boxes pra não passar do limite de voltas
"we've done as many laps as we're allowed, box this lap","Atingimos o número máximo de voltas, entra nessa volta"
"we've used our lap allowance, pit this lap","Já usamos nosso limite de voltas, box agora"
"headlights are required, turn them on, please","Faróis obrigatórios, liga aí, por favor"
headlights are now required,Os faróis agora são obrigatórios
"you need to turn your headlights on, headlights are required now","Liga os faróis, a direção exigiu"
your penalty's completed,Sua penalidade foi cumprida
you served your penalty,Penalidade cumprida com sucesso
you've served your penalty,Você já serviu sua penalidade
"box, box, box, serve this drive-through now","Box, box, box! Cumpre o drive-through agora"
pit now for your drive-through penalty,"Entra nos boxes agora pra cumprir o drive-through, "
box now for your drive-through,Box agora pro drive-through
you still have to serve this drive-through penalty,Você ainda precisa cumprir o drive-through
we still need to serve our drive-through penalty,Ainda temos um drive-through pra cumprir
we've still got to serve this drive-through penalty,Ainda temos que cumprir essa penalidade de drive-through
we still got to serve this drive-through penalty,A penalidade de drive-through ainda precisa ser cumprida
you still need to serve your drive-through penalty,Você ainda precisa cumprir sua penalidade de drive-through
"you've cut again, stop taking the piss","De novo você cortou a pista, pô, para com isso"
"we're still cutting, get on top of it, please","A gente ainda tá cortando pista, fica em cima disso aí, por favor"
stop this persistent cutting,"Chega desse corte insistente, vamos parar com isso"
"come on I'm sick of telling you, watch the bloody track limits","Vamos lá, tô cansado de repetir, presta atenção nesses limites!"
pay more attention to track limits,Precisa prestar mais atenção nos limites da pista
"shit, man, that's another cut, come on, track limits","Ah não, cara mais um corte! Limite de pista, vamos!"
we've had another track limits warning,Recebemos mais um alerta por limite de pista
"come on, stop cutting","Vamos lá, para de cortar a pista"
"track limits, please, we don't want a penalty","Limite de pista, por favor, não queremos penalidade"
"track limits, again","De novo esse limite de pista, hein"
if you don't stop cutting we will get a penalty,"Se continuar cortando, vamos ser penalizados"
"the stewards have warned us again, track limits","Os comissários já alertaram de novo, limite de pista"
you've really gotta pay attention to these track limits,"Tem que prestar atenção nesses limites, sério mesmo"
we've had another warning about track limits,Mais um aviso por limite de pista
"come on, get it together, you keep cutting","Vamos, se concentra, você continua cortando"
start taking these track limits seriously,Começa a levar os limites de pista a sério
"you've cut the track again, concentrate","Você cortou a pista de novo, foca aí!"
please watch the track limits,"Por favor, atenção aos limites da pista"
we've just had a drive-through for overtaking under the pace car,Acabamos de levar um drive-through por ultrapassar o carro de segurança
we've just had a drive-through for passing under the pace car,Drive-through aplicado por passar o pace car
we've just had a drive-through for overtaking under pace car,Tomamos um drive-through por ultrapassagem sob carro de segurança
"step it down a bit, mate, we've had a warning for unsportsmanlike driving","Acalma aí, parceiro, recebemos um aviso por conduta antidesportiva"
we've just had a warning for unsportsmanlike driving,Acabamos de receber um aviso por pilotagem antidesportiva
we've had a warning for unsportsmanlike driving,Já temos um aviso por conduta antidesportiva
"we've just had a warning for unsportsmanlike driving, come on, calm it down","Levamos um aviso por direção antidesportiva, se controla aí"
